{
  "transaction_id": "tx_normal_001",
  "initiator_user_id": "user_001",
  "source_wallet_id": "wallet_src_001",
  "destination_wallet_id": "wallet_dst_001",
  "amount": 50.0,
  "currency": "PYC",
  "transaction_type": "P2P",
  "direction": "outgoing",
  "created_at": "2026-01-21T12:00:00Z",
  "country": "FR",
  "city": "Paris",
  "description": "Transaction normale"
}

