[
  {
    "transaction_id": "tx_test_001",
    "initiator_user_id": "user_123",
    "source_wallet_id": "w_src_456",
    "destination_wallet_id": "w_dst_789",
    "amount": 100.0,
    "currency": "PYC",
    "transaction_type": "P2P",
    "direction": "outgoing",
    "created_at": "2026-01-21T12:00:00Z",
    "country": "FR"
  },
  {
    "transaction_id": "tx_test_002",
    "initiator_user_id": "user_123",
    "source_wallet_id": "w_src_456",
    "destination_wallet_id": "w_dst_999",
    "amount": 350.0,
    "currency": "PYC",
    "transaction_type": "P2P",
    "direction": "outgoing",
    "created_at": "2026-01-21T13:00:00Z",
    "country": "FR"
  },
  {
    "transaction_id": "tx_test_003",
    "initiator_user_id": "user_456",
    "source_wallet_id": "w_src_789",
    "destination_wallet_id": "w_dst_123",
    "amount": 50.0,
    "currency": "PYC",
    "transaction_type": "P2P",
    "direction": "outgoing",
    "created_at": "2026-01-21T14:00:00Z",
    "country": "KP"
  }
]
