[
  {
    "transaction_id": "tx_normal_001",
    "initiator_user_id": "user_001",
    "source_wallet_id": "wallet_src_001",
    "destination_wallet_id": "wallet_dst_001",
    "amount": 50.0,
    "currency": "PYC",
    "transaction_type": "P2P",
    "direction": "outgoing",
    "created_at": "2026-01-21T12:00:00Z",
    "country": "FR",
    "city": "Paris",
    "description": "Transaction normale"
  },
  {
    "transaction_id": "tx_normal_001",
    "initiator_user_id": "user_001",
    "source_wallet_id": "wallet_src_001",
    "destination_wallet_id": "wallet_dst_001",
    "amount": 50.0,
    "currency": "PYC",
    "transaction_type": "P2P",
    "direction": "outgoing",
    "created_at": "2026-01-21T12:00:00Z",
    "country": "FR",
    "city": "Paris",
    "description": "Transaction normale"
  },
  {
    "transaction_id": "tx_normal_001",
    "initiator_user_id": "user_001",
    "source_wallet_id": "wallet_src_001",
    "destination_wallet_id": "wallet_dst_001",
    "amount": 50.0,
    "currency": "PYC",
    "transaction_type": "P2P",
    "direction": "outgoing",
    "created_at": "2026-01-21T12:00:00Z",
    "country": "FR",
    "city": "Paris",
    "description": "Transaction normale"
  },
  {
    "transaction_id": "1234567890",
    "initiator_user_id": "123456789",
    "source_wallet_id": "12345678",
    "destination_wallet_id": "12345679",
    "amount": 200.0,
    "currency": "PYC",
    "transaction_type": "P2P",
    "direction": "incoming",
    "created_at": "2026-01-22T14:05:24.986118Z",
    "country": "FR",
    "city": "Bordeaux",
    "description": "Description"
  },
  {
    "transaction_id": "tx_normal_001",
    "initiator_user_id": "user_001",
    "source_wallet_id": "wallet_src_001",
    "destination_wallet_id": "wallet_dst_001",
    "amount": 50.0,
    "currency": "PYC",
    "transaction_type": "P2P",
    "direction": "outgoing",
    "created_at": "2026-01-21T12:00:00Z",
    "country": "FR",
    "city": "Paris",
    "description": "Transaction normale"
  },
  {
    "transaction_id": "tx_normal_001",
    "initiator_user_id": "user_001",
    "source_wallet_id": "wallet_src_001",
    "destination_wallet_id": "wallet_dst_001",
    "amount": 50.0,
    "currency": "PYC",
    "transaction_type": "P2P",
    "direction": "outgoing",
    "created_at": "2026-01-21T12:00:00Z",
    "country": "FR",
    "city": "Paris",
    "description": "Transaction normale"
  }
]